{
  "$schema": "http://json-schema.org/draft-07/schema",
  "$id": "https://www.alpinebits.org/destinationdata/schemas/2022-04/snowpark",
  "description": "A resource that implements the concept of Snowpark defined in the AlpineBitsÂ® DestinationData Ontology.",
  "type": "object",
  "additionalProperties": false,
  "required": ["type"],
  "properties": {
    "id": {
      "$ref": "/destinationdata/schemas/2022-04/datatypes#/definitions/id"
    },
    "type": {
      "const": "snowparks"
    },
    "meta": {
      "$ref": "/destinationdata/schemas/2022-04/datatypes#/definitions/meta"
    },
    "links": {
      "$ref": "/destinationdata/schemas/2022-04/datatypes#/definitions/links"
    },
    "attributes": {
      "type": "object",
      "additionalProperties": false,
      "properties": {
        "abstract": {
          "oneOf": [
            {
              "type": "null"
            },
            {
              "$ref": "/destinationdata/schemas/2022-04/datatypes#/definitions/text"
            }
          ]
        },
        "address": {
          "oneOf": [
            {
              "type": "null"
            },
            {
              "$ref": "/destinationdata/schemas/2022-04/datatypes#/definitions/address"
            }
          ]
        },
        "description": {
          "oneOf": [
            {
              "type": "null"
            },
            {
              "$ref": "/destinationdata/schemas/2022-04/datatypes#/definitions/text"
            }
          ]
        },
        "difficulty": {
          "type":["null", "string"],
          "enum": [null, "beginner", "intermediate", "advanced", "expert"]
        },
        "geometries": {
          "type": [ "null", "array" ],
          "minItems": 1,
          "additionalItems": false,
          "items": {
            "$ref": "/destinationdata/schemas/2022-04/datatypes#/definitions/geometry"
          }
        },
        "howToArrive": {
          "oneOf": [
            {
              "type": "null"
            },
            {
              "$ref": "/destinationdata/schemas/2022-04/datatypes#/definitions/text"
            }
          ]
        },
        "length": {
          "type": [ "null", "number" ],
          "exclusiveMinimum": 0
        },
        "maxAltitude": {
          "type": [ "null", "number" ]
        },
        "minAltitude": {
          "type": [ "null", "number" ]
        },
        "name": {
          "$ref": "/destinationdata/schemas/2022-04/datatypes#/definitions/text"
        },
        "openingHours": {
          "oneOf": [
            {
              "type": "null"
            },
            {
              "$ref": "/destinationdata/schemas/2022-04/datatypes#/definitions/hoursSpecification"
            }
          ]
        },
        "shortName": {
          "oneOf": [
            {
              "type": "null"
            },
            {
              "$ref": "/destinationdata/schemas/2022-04/datatypes#/definitions/text"
            }
          ]
        },
        "snowCondition": {
          "oneOf": [
            {
              "type": "null"
            },
            {
              "$ref": "/destinationdata/schemas/2022-04/datatypes#/definitions/snowCondition"
            }
          ]
        },
        "url": {
          "oneOf": [
            {
              "type": "null"
            },
            {
              "$ref": "/destinationdata/schemas/2022-04/datatypes#/definitions/complexUrl"
            }
          ]
        }
      }
    },
    "relationships": {
      "type": "object",
      "additionalProperties": false,
      "properties": {
        "categories": {
          "oneOf": [
            {
              "type": "null"
            },
            {
              "$ref": "/destinationdata/schemas/2022-04/datatypes#/definitions/relationshipToMany"
            }
          ]
        },
        "connections": {
          "oneOf": [
            {
              "type": "null"
            },
            {
              "$ref": "/destinationdata/schemas/2022-04/datatypes#/definitions/relationshipToMany"
            }
          ]
        },
        "features": {
          "oneOf": [
            {
              "type": "null"
            },
            {
              "$ref": "/destinationdata/schemas/2022-04/datatypes#/definitions/relationshipToMany"
            }
          ]
        },
        "multimediaDescriptions": {
          "oneOf": [
            {
              "type": "null"
            },
            {
              "$ref": "/destinationdata/schemas/2022-04/datatypes#/definitions/relationshipToMany"
            }
          ]
        }
      }
    }
  }
}
